{
  "name": {
    "entityName": "Aldi Einkauf GmbH & Co. oHG Süd",
    "displayName": "ALDI Süd"
  },
  "address": {
    "name": {
      "$ref":  "#/name/displayName"
    },
    "street": {
      "name": "Burgstraße",
      "number": 37
    },
    "zip": "45476",
    "city": "Mülheim an der Ruhr",
    "country": "DE",
    "gps": {
      "latitude": 51.441050,
      "longitude": 6.861170
    }
  },
  "communication": {

  },
  "taxId": "DE127135609"
}
